{
  "generated_at": "2026-07-09",
  "source": {
    "places": "data/jeju_accessible_spots.json",
    "scoring_policy": "src/scoring.py",
    "runtime_service": "src/recommendation_service.py"
  },
  "summary": {
    "total_cases": 5,
    "passed_cases": 5,
    "failed_cases": 0,
    "overall_status": "통과"
  },
  "cases": [
    {
      "id": "recovery_quiet",
      "label": "회복 중",
      "title": "짧고 조용한 회복 여행",
      "intent": "체력 저하와 긴 걷기 부담을 줄이고, 식사·혼잡·장시간 야외 체류 위험을 피하는 코스",
      "status": "통과",
      "traveler_summary": {
        "traveler_type": [
          "recovery_traveler",
          "caregiver_group"
        ],
        "mobility_conditions": [
          "체력 저하",
          "긴 걷기 어려움",
          "휴식 필요"
        ],
        "preferred_themes": [
          "실내",
          "문화",
          "휴식"
        ],
        "required_accessibility": [
          "장애인 화장실",
          "주차",
          "휴식 공간"
        ],
        "avoid": [
          "식당 제외",
          "혼잡",
          "장시간 야외 체류"
        ]
      },
      "expected_policy": {
        "recommendation_direction": "도보 부담이 낮은 실내·문화·휴식 중심 장소를 우선한다.",
        "minimum_total_score": 85,
        "selected_exclude_categories": [
          "food_market",
          "restaurant"
        ],
        "required_check_terms": [
          "식사",
          "혼잡",
          "휴식"
        ],
        "required_fit_terms": [
          "도보 부담",
          "편의시설"
        ],
        "policy_effect_terms": [
          "식사",
          "혼잡"
        ]
      },
      "recommendation": {
        "score": {
          "total": 92,
          "grade": "A",
          "confidence": "medium",
          "breakdown": {
            "source_trust": {
              "score": 25,
              "max": 25,
              "reason": "정보 상태 verified, 출처 있음 기준"
            },
            "mobility_fit": {
              "score": 25,
              "max": 25,
              "reason": "도보 부담 very_low 및 경사·바닥 상태 기준"
            },
            "facility_fit": {
              "score": 18,
              "max": 20,
              "reason": "화장실, 주차, 휴식, 대여, 휠체어 접근성 기준"
            },
            "theme_fit": {
              "score": 15,
              "max": 15,
              "reason": "선호 테마와 indoor 카테고리 일치"
            },
            "safety_clarity": {
              "score": 15,
              "max": 15,
              "reason": "안전 메모, 회피 대상, 확인 필요 항목 기준"
            }
          }
        },
        "route": [
          {
            "order": 1,
            "spot_id": "jeju_indoor_literature_022",
            "name": "제주문학관",
            "category": "indoor",
            "score_total": 98,
            "walking_level": "very_low",
            "weather_sensitivity": "low",
            "verification_status": "verified"
          },
          {
            "order": 2,
            "spot_id": "jeju_indoor_hanran_016",
            "name": "제주한란전시관",
            "category": "indoor",
            "score_total": 91,
            "walking_level": "low",
            "weather_sensitivity": "low",
            "verification_status": "partial"
          },
          {
            "order": 3,
            "spot_id": "jeju_forest_saryeoni_002",
            "name": "사려니숲길 무장애나눔길",
            "category": "forest",
            "score_total": 90,
            "walking_level": "low",
            "weather_sensitivity": "medium",
            "verification_status": "verified"
          },
          {
            "order": 4,
            "spot_id": "jeju_indoor_icc_032",
            "name": "제주국제컨벤션센터",
            "category": "indoor",
            "score_total": 90,
            "walking_level": "low",
            "weather_sensitivity": "low",
            "verification_status": "verified"
          }
        ],
        "fit_reasons": [
          "도보 부담이 낮은 편으로 사용자의 이동 조건과 맞습니다.",
          "필수 편의시설 정보가 비교적 잘 맞습니다.",
          "선호 테마와 장소 성격이 잘 맞습니다."
        ],
        "deduction_reasons": [
          "날씨 영향을 받을 수 있어 우천·강풍 여부 확인이 필요합니다.",
          "혼잡 또는 감염 우려 조건이 있어 사람이 몰릴 수 있는 장소를 감점합니다."
        ],
        "check_before_visit": [
          "휴식 공간",
          "혼잡도",
          "개별 식사 준비 가능 여부",
          "식사 장소 제외 여부",
          "혼잡 시간대",
          "대기줄 여부",
          "주말·성수기 방문 여부",
          "휠체어 접근성",
          "바닥 상태",
          "방문 당일 날씨와 바람"
        ]
      },
      "validation": {
        "total_checks": 12,
        "passed_checks": 12,
        "failed_checks": 0,
        "checks": [
          {
            "area": "추천",
            "name": "추천 장소 수",
            "status": "통과",
            "expected": "조건에 맞는 추천 장소가 1곳 이상 있어야 함",
            "actual": "4곳: 제주문학관, 제주한란전시관, 사려니숲길 무장애나눔길, 제주국제컨벤션센터"
          },
          {
            "area": "추천",
            "name": "총점 기준",
            "status": "통과",
            "expected": "85점 이상",
            "actual": "92점"
          },
          {
            "area": "추천",
            "name": "추천 장소 차단 여부",
            "status": "통과",
            "expected": "차단 장소가 추천 결과에 없어야 함",
            "actual": "차단 장소 없음"
          },
          {
            "area": "추천",
            "name": "도보 부담",
            "status": "통과",
            "expected": "낮음, 매우 낮음만 허용",
            "actual": "매우 낮음, 낮음, 낮음, 낮음"
          },
          {
            "area": "제외",
            "name": "상위 추천 제외 유형",
            "status": "통과",
            "expected": "먹거리 시장, 식당 미포함",
            "actual": "실내, 실내, 숲·산책, 실내"
          },
          {
            "area": "설명",
            "name": "추천 근거: 도보 부담",
            "status": "통과",
            "expected": "도보 부담 관련 근거가 있어야 함",
            "actual": "도보 부담이 낮은 편으로 사용자의 이동 조건과 맞습니다."
          },
          {
            "area": "설명",
            "name": "추천 근거: 편의시설",
            "status": "통과",
            "expected": "편의시설 관련 근거가 있어야 함",
            "actual": "필수 편의시설 정보가 비교적 잘 맞습니다."
          },
          {
            "area": "설명",
            "name": "방문 전 확인: 식사",
            "status": "통과",
            "expected": "식사 관련 근거가 있어야 함",
            "actual": "개별 식사 준비 가능 여부"
          },
          {
            "area": "설명",
            "name": "방문 전 확인: 혼잡",
            "status": "통과",
            "expected": "혼잡 관련 근거가 있어야 함",
            "actual": "혼잡도"
          },
          {
            "area": "설명",
            "name": "방문 전 확인: 휴식",
            "status": "통과",
            "expected": "휴식 관련 근거가 있어야 함",
            "actual": "휴식 공간"
          },
          {
            "area": "감점/제외",
            "name": "정책 효과: 식사",
            "status": "통과",
            "expected": "식사 관련 근거가 있어야 함",
            "actual": "음식 제한 조건이 있어 식사 중심 장소를 제외하거나 감점합니다. 이 장소 유형은 제외 대상입니다."
          },
          {
            "area": "감점/제외",
            "name": "정책 효과: 혼잡",
            "status": "통과",
            "expected": "혼잡 관련 근거가 있어야 함",
            "actual": "혼잡 또는 감염 우려 조건이 있어 사람이 몰릴 수 있는 장소를 감점합니다."
          }
        ]
      },
      "excluded_candidates": [
        {
          "spot_id": "jeju_sea_saeyeongyo_039",
          "name": "새연교",
          "category": "sea",
          "score_total": 49,
          "blocked": true,
          "block_reasons": [
            "사용자가 피하고 싶은 조건과 장소 주의사항이 충돌합니다."
          ],
          "deduction_reasons": [
            "야외 체류 부담이 높아 체력 저하 사용자에게는 짧은 방문이 필요합니다.",
            "날씨 영향을 받을 수 있어 우천·강풍 여부 확인이 필요합니다.",
            "체력 저하 또는 회복 중 사용자에게 장시간 야외 체류 가능성이 큽니다.",
            "혼잡 또는 감염 우려 조건이 있어 사람이 몰릴 수 있는 장소를 감점합니다.",
            "사용자가 피하고 싶은 조건과 장소 주의사항이 충돌합니다."
          ]
        },
        {
          "spot_id": "jeju_forest_cheonjiyeon_014",
          "name": "천지연폭포",
          "category": "forest",
          "score_total": 48,
          "blocked": true,
          "block_reasons": [
            "사용자가 피하고 싶은 조건과 장소 주의사항이 충돌합니다."
          ],
          "deduction_reasons": [
            "도보 부담이 중간 수준이라 짧은 구간 중심으로 확인이 필요합니다.",
            "야외 체류 부담이 높아 체력 저하 사용자에게는 짧은 방문이 필요합니다.",
            "날씨 영향을 받을 수 있어 우천·강풍 여부 확인이 필요합니다.",
            "요청한 장애인 화장실 정보가 충분하지 않습니다.",
            "체력 저하 또는 회복 중 사용자에게 장시간 야외 체류 가능성이 큽니다.",
            "사용자가 피하고 싶은 조건과 장소 주의사항이 충돌합니다."
          ]
        },
        {
          "spot_id": "jeju_food_market_olle_035",
          "name": "서귀포매일올레시장",
          "category": "food_market",
          "score_total": 48,
          "blocked": true,
          "block_reasons": [
            "음식 제한 조건이 있어 식사 중심 장소를 제외하거나 감점합니다. 이 장소 유형은 제외 대상입니다."
          ],
          "deduction_reasons": [
            "도보 부담이 중간 수준이라 짧은 구간 중심으로 확인이 필요합니다.",
            "날씨 영향을 받을 수 있어 우천·강풍 여부 확인이 필요합니다.",
            "음식 제한 조건이 있어 식사 중심 장소를 제외하거나 감점합니다.",
            "혼잡 또는 감염 우려 조건이 있어 사람이 몰릴 수 있는 장소를 감점합니다.",
            "음식 제한 조건이 있어 식사 중심 장소를 제외하거나 감점합니다. 이 장소 유형은 제외 대상입니다."
          ]
        },
        {
          "spot_id": "jeju_other_dongmun_market_029",
          "name": "동문재래시장",
          "category": "food_market",
          "score_total": 46,
          "blocked": true,
          "block_reasons": [
            "음식 제한 조건이 있어 식사 중심 장소를 제외하거나 감점합니다. 이 장소 유형은 제외 대상입니다."
          ],
          "deduction_reasons": [
            "도보 부담이 중간 수준이라 짧은 구간 중심으로 확인이 필요합니다.",
            "날씨 영향을 받을 수 있어 우천·강풍 여부 확인이 필요합니다.",
            "음식 제한 조건이 있어 식사 중심 장소를 제외하거나 감점합니다.",
            "혼잡 또는 감염 우려 조건이 있어 사람이 몰릴 수 있는 장소를 감점합니다.",
            "음식 제한 조건이 있어 식사 중심 장소를 제외하거나 감점합니다. 이 장소 유형은 제외 대상입니다."
          ]
        },
        {
          "spot_id": "jeju_restaurant_nangtteule_036",
          "name": "낭뜰에쉼팡",
          "category": "restaurant",
          "score_total": 27,
          "blocked": true,
          "block_reasons": [
            "음식 제한 조건이 있어 식사 중심 장소를 제외하거나 감점합니다. 이 장소 유형은 제외 대상입니다."
          ],
          "deduction_reasons": [
            "도보 부담이 중간 수준이라 짧은 구간 중심으로 확인이 필요합니다.",
            "요청한 장애인 화장실 정보가 충분하지 않습니다.",
            "요청한 주차 정보가 충분하지 않습니다.",
            "장애인 화장실을 필수로 요청했지만 정보가 부족합니다.",
            "음식 제한 조건이 있어 식사 중심 장소를 제외하거나 감점합니다.",
            "혼잡 또는 감염 우려 조건이 있어 사람이 몰릴 수 있는 장소를 감점합니다.",